{
  "schema": "brvario.flight-site",
  "schemaVersion": 1,
  "id": 1537,
  "slug": "conquista-doeste-rampa-paraiso-mt",
  "name": "RAMPA PARAÍSO",
  "city": "CONQUISTA D’OESTE",
  "state": "MT",
  "country": "BR",
  "coordinates": {
    "latitudeE7": -145223450,
    "longitudeE7": -594687150
  },
  "terrain": {
    "altitudeM": 646,
    "verticalDropM": 346
  },
  "windQuadrants": [
    "E",
    "N",
    "NW",
    "S",
    "SE",
    "SW",
    "W"
  ],
  "provenance": {
    "dataOwner": "BRVARIO",
    "sourceName": "Guia 4 Ventos - referência factual",
    "sourceUrl": "https://guia4ventos.com.br/conquista-doeste-rampa-paraiso-mt/",
    "referenceUrl": "https://guia4ventos.com.br/conquista-doeste-rampa-paraiso-mt/",
    "license": "NOASSERTION - somente fatos objetivos, sem conteúdo editorial",
    "contributedBy": "Importador factual BRVARIO",
    "lastVerified": "2026-06-19"
  }
}
