{
  "schema": "brvario.flight-site",
  "schemaVersion": 1,
  "id": 3370,
  "slug": "rampa-do-sitio-do-diogo-mg",
  "name": "RAMPA DO SITIO DO DIOGO",
  "city": "SANTA RITA DE JACUTINGA",
  "state": "MG",
  "country": "BR",
  "coordinates": {
    "latitudeE7": -220891890,
    "longitudeE7": -440562390
  },
  "terrain": {
    "altitudeM": 210,
    "verticalDropM": 750
  },
  "windQuadrants": [
    "S"
  ],
  "provenance": {
    "dataOwner": "BRVARIO",
    "sourceName": "Guia 4 Ventos - referência factual",
    "sourceUrl": "https://guia4ventos.com.br/rampa-do-sitio-do-diogo-mg/",
    "referenceUrl": "https://guia4ventos.com.br/rampa-do-sitio-do-diogo-mg/",
    "license": "NOASSERTION - somente fatos objetivos, sem conteúdo editorial",
    "contributedBy": "Importador factual BRVARIO",
    "lastVerified": "2026-06-19"
  }
}
