{
  "schema": "brvario.flight-site",
  "schemaVersion": 1,
  "id": 1621,
  "slug": "sao-luis-rampa-marafolia-praia-do-calhau-ma",
  "name": "RAMPA MARAFOLIA - PRAIA DO CALHAU",
  "city": "SÃO LUIS",
  "state": "MA",
  "country": "BR",
  "coordinates": {
    "latitudeE7": -24830040,
    "longitudeE7": -442443550
  },
  "terrain": {
    "altitudeM": 35,
    "verticalDropM": 39
  },
  "windQuadrants": [
    "NE"
  ],
  "provenance": {
    "dataOwner": "BRVARIO",
    "sourceName": "Guia 4 Ventos - referência factual",
    "sourceUrl": "https://guia4ventos.com.br/sao-luis-rampa-marafolia-praia-do-calhau-ma/",
    "referenceUrl": "https://guia4ventos.com.br/sao-luis-rampa-marafolia-praia-do-calhau-ma/",
    "license": "NOASSERTION - somente fatos objetivos, sem conteúdo editorial",
    "contributedBy": "Importador factual BRVARIO",
    "lastVerified": "2026-06-19"
  }
}
