{
  "schema": "brvario.flight-site",
  "schemaVersion": 1,
  "id": 1783,
  "slug": "jacobina-rampa-gezer-cerqueira-ba",
  "name": "RAMPA GEZER CERQUEIRA",
  "city": "JACOBINA",
  "state": "BA",
  "country": "BR",
  "coordinates": {
    "latitudeE7": -111949050,
    "longitudeE7": -404702750
  },
  "terrain": {
    "altitudeM": 730,
    "verticalDropM": 240
  },
  "windQuadrants": [
    "E",
    "NE",
    "SE"
  ],
  "provenance": {
    "dataOwner": "BRVARIO",
    "sourceName": "Guia 4 Ventos - referência factual",
    "sourceUrl": "https://guia4ventos.com.br/jacobina-rampa-gezer-cerqueira-ba/",
    "referenceUrl": "https://guia4ventos.com.br/jacobina-rampa-gezer-cerqueira-ba/",
    "license": "NOASSERTION - somente fatos objetivos, sem conteúdo editorial",
    "contributedBy": "Importador factual BRVARIO",
    "lastVerified": "2026-06-19"
  }
}
