{
  "schema": "brvario.flight-site",
  "schemaVersion": 1,
  "id": 1960,
  "slug": "jatai-rampa-de-corrego-dantas-go",
  "name": "RAMPA DE CÓRREGO DANTAS",
  "city": "JATAÍ",
  "state": "GO",
  "country": "BR",
  "coordinates": {
    "latitudeE7": -172867510,
    "longitudeE7": -518512200
  },
  "terrain": {
    "altitudeM": 723,
    "verticalDropM": 200
  },
  "windQuadrants": [
    "N",
    "NE",
    "NW"
  ],
  "provenance": {
    "dataOwner": "BRVARIO",
    "sourceName": "Guia 4 Ventos - referência factual",
    "sourceUrl": "https://guia4ventos.com.br/jatai-rampa-de-corrego-dantas-go/",
    "referenceUrl": "https://guia4ventos.com.br/jatai-rampa-de-corrego-dantas-go/",
    "license": "NOASSERTION - somente fatos objetivos, sem conteúdo editorial",
    "contributedBy": "Importador factual BRVARIO",
    "lastVerified": "2026-06-19"
  }
}
