{
  "schema": "brvario.flight-site",
  "schemaVersion": 1,
  "id": 3667,
  "slug": "mantena-rampa-corujinha-mg",
  "name": "RAMPA CORUJINHA",
  "city": "MANTENA",
  "state": "MG",
  "country": "BR",
  "coordinates": {
    "latitudeE7": -187880170,
    "longitudeE7": -410211810
  },
  "terrain": {
    "altitudeM": 659,
    "verticalDropM": 430
  },
  "windQuadrants": [
    "E",
    "N",
    "NE",
    "NW",
    "SE"
  ],
  "provenance": {
    "dataOwner": "BRVARIO",
    "sourceName": "Guia 4 Ventos - referência factual",
    "sourceUrl": "https://guia4ventos.com.br/mantena-rampa-corujinha-mg/",
    "referenceUrl": "https://guia4ventos.com.br/mantena-rampa-corujinha-mg/",
    "license": "NOASSERTION - somente fatos objetivos, sem conteúdo editorial",
    "contributedBy": "Importador factual BRVARIO",
    "lastVerified": "2026-06-19"
  }
}
