{
  "schema": "brvario.flight-site",
  "schemaVersion": 1,
  "id": 3441,
  "slug": "pimenta-rampa-do-cruzeiro-serra-do-chapadao-mg",
  "name": "RAMPA DO CRUZEIRO - SERRA DO CHAPADÃO",
  "city": "PIMENTA",
  "state": "MG",
  "country": "BR",
  "coordinates": {
    "latitudeE7": -205688870,
    "longitudeE7": -458750280
  },
  "terrain": {
    "altitudeM": 1200,
    "verticalDropM": 380
  },
  "windQuadrants": [
    "E",
    "N",
    "NE",
    "SE",
    "W"
  ],
  "provenance": {
    "dataOwner": "BRVARIO",
    "sourceName": "Guia 4 Ventos - referência factual",
    "sourceUrl": "https://guia4ventos.com.br/pimenta-rampa-do-cruzeiro-serra-do-chapadao-mg/",
    "referenceUrl": "https://guia4ventos.com.br/pimenta-rampa-do-cruzeiro-serra-do-chapadao-mg/",
    "license": "NOASSERTION - somente fatos objetivos, sem conteúdo editorial",
    "contributedBy": "Importador factual BRVARIO",
    "lastVerified": "2026-06-19"
  }
}
