{
  "schema": "brvario.flight-site",
  "schemaVersion": 1,
  "id": 3555,
  "slug": "bugre-rampa-dos-bandeirantes-mg",
  "name": "RAMPA DOS BANDEIRANTES",
  "city": "BUGRE",
  "state": "MG",
  "country": "BR",
  "coordinates": {
    "latitudeE7": -193774700,
    "longitudeE7": -422806530
  },
  "terrain": {
    "altitudeM": 780,
    "verticalDropM": 550
  },
  "windQuadrants": [
    "E",
    "N",
    "NE",
    "NW"
  ],
  "provenance": {
    "dataOwner": "BRVARIO",
    "sourceName": "Guia 4 Ventos - referência factual",
    "sourceUrl": "https://guia4ventos.com.br/bugre-rampa-dos-bandeirantes-mg/",
    "referenceUrl": "https://guia4ventos.com.br/bugre-rampa-dos-bandeirantes-mg/",
    "license": "NOASSERTION - somente fatos objetivos, sem conteúdo editorial",
    "contributedBy": "Importador factual BRVARIO",
    "lastVerified": "2026-06-19"
  }
}
