{
  "schema": "brvario.flight-site",
  "schemaVersion": 1,
  "id": 1594,
  "slug": "presidente-medici-rampa-de-presidente-medici-ro",
  "name": "RAMPA DE PRESIDENTE MÉDICI",
  "city": "PRESIDENTE MÉDICI",
  "state": "RO",
  "country": "BR",
  "coordinates": {
    "latitudeE7": -112735140,
    "longitudeE7": -618598620
  },
  "terrain": {
    "altitudeM": 270,
    "verticalDropM": 270
  },
  "windQuadrants": [
    "N"
  ],
  "provenance": {
    "dataOwner": "BRVARIO",
    "sourceName": "Guia 4 Ventos - referência factual",
    "sourceUrl": "https://guia4ventos.com.br/presidente-medici-rampa-de-presidente-medici-ro/",
    "referenceUrl": "https://guia4ventos.com.br/presidente-medici-rampa-de-presidente-medici-ro/",
    "license": "NOASSERTION - somente fatos objetivos, sem conteúdo editorial",
    "contributedBy": "Importador factual BRVARIO",
    "lastVerified": "2026-06-19"
  }
}
